<?xml version="1.0" encoding="ISO-8859-1"?>
<!DOCTYPE Debate SYSTEM "../Debate.dtd"[]>
<Debate DocTitle="Seanad Debate" Day="Fri" Date="2" Month="Dec" Year="1927" Vol="10" No="6" DateIrish="Dé hAoine, 2 Nollaig 1927" DateEnglish="Friday, 2 December 1927" House="S" CommitteeEng="" CommitteeIr="" SubNameEng="" cnum="183">
  <MainHeading Type="Prelude" LHead="" RHead="">
    <Title>
    </Title>
    <P>
      <Col N="183" /> Do chuaidh an Cathaoirleach i gceannas ar 12 meadhon lae.</P>
  </MainHeading>
  <MainHeading Type="GD" LHead="PRIVATE BUSINESS. - PILOTAGE ORDER CONFIRMATION" RHead="(No. 2) BILL, 1927&mdash;FIFTH STAGE">
    <Title>PRIVATE BUSINESS. - PILOTAGE ORDER CONFIRMATION (No. 2) BILL, 1927&mdash;FIFTH STAGE.</Title>
    <P>Motion made&mdash;That this Bill be received for final consideration and do now pass.&mdash;(Senator Bennett.)</P>
    <P>Question put and agreed to.</P>
  </MainHeading>
  <MainHeading Type="GD" LHead="PUBLIC BUSINESS. - LOCAL ELECTIONS" RHead="BILL, 1927&mdash;REPORT STAGE">
    <Title>PUBLIC BUSINESS. - LOCAL ELECTIONS BILL, 1927&mdash;REPORT STAGE.</Title>
    <Speaker pid="" hpid="CATHAOIRLEACH CATHAOIRLEACH">
      <NameTxt>CATHAOIRLEACH</NameTxt>
      <P>There were no amendments in Committee to this Bill, and no amendments have been tabled for the Report Stage.</P>
      <P>Motion made&mdash;That the Bill be received on Report.</P>
      <P>Question put and agreed to.</P>
    </Speaker>
  </MainHeading>
  <MainHeading Type="GD" LHead="PUBLIC BUSINESS. - DEFENCE FORCES (TEMPORARY" RHead="PROVISIONS) (No. 2) BILL, 1927&mdash;REPORT STAGE">
    <Title>PUBLIC BUSINESS. - DEFENCE FORCES (TEMPORARY PROVISIONS) (No. 2) BILL, 1927&mdash;REPORT STAGE.</Title>
    <P>Motion made&mdash;That the Bill be received on Report.</P>
    <P>Question put and agreed to.</P>
  </MainHeading>
  <MainHeading Type="GD" LHead="PUBLIC BUSINESS. - FINANCE (No." RHead="2) BILL, 1927&mdash;REPORT STAGE">
    <Title>PUBLIC BUSINESS. - FINANCE (No. 2) BILL, 1927&mdash;REPORT STAGE.</Title>
    <Speaker pid="" hpid="CATHAOIRLEACH CATHAOIRLEACH">
      <NameTxt>CATHAOIRLEACH</NameTxt>
      <P>This Bill has been certified by the Ceann Comhairle of the Dáil as a Money Bill.</P>
      <P>Motion made&mdash;That the Bill be received on Report.</P>
      <P>Question put and agreed to.</P>
    </Speaker>
  </MainHeading>
  <MainHeading Type="GD" LHead="PUBLIC BUSINESS. - SUSPENSION" RHead="OF STANDING ORDERS">
    <Title>PUBLIC BUSINESS. - SUSPENSION OF STANDING ORDERS.</Title>
    <Speaker pid="EdwardBellinghamBart" hpid="Sir HENRY BELLINGHAM Sir HENRY BELLINGHAM">
      <NameTxt>Sir HENRY BELLINGHAM</NameTxt>
      <P>On behalf of Senator Guinness, I move:&mdash;<Col N="184" />&ldquo;That the Standing Orders be suspended for the purpose of enabling the Fifth Stage of the following Bills to be taken to-day, Friday, 2nd December, 1927:&mdash;Local Elections Bill, 1927, Defence Forces (Temporary Provisions) (No. 2) Bill, 1927, and the Finance (No. 2) Bill, 1927.&rdquo;</P>
    </Speaker>
    <Speaker pid="WilliamBarrington" hpid="Mr. BARRINGTON Mr. BARRINGTON">
      <NameTxt>Mr. BARRINGTON</NameTxt>
      <P>I second the motion.</P>
      <P>Question put and agreed to.</P>
      <P>Standing Orders suspended.</P>
    </Speaker>
  </MainHeading>
  <MainHeading Type="GD" LHead="PUBLIC BUSINESS. - LOCAL ELECTIONS" RHead="BILL, 1927&mdash;FIFTH STAGE">
    <Title>PUBLIC BUSINESS. - LOCAL ELECTIONS BILL, 1927&mdash;FIFTH STAGE.</Title>
    <P>Motion made&mdash;That the Bill be received for final consideration and do now pass.</P>
    <P>Question put and agreed to.</P>
  </MainHeading>
  <MainHeading Type="GD" LHead="PUBLIC BUSINESS. - DEFENCE FORCES (TEMPORARY" RHead="PROVISIONS) (No. 2) BILL, 1927&mdash;FIFTH STAGE">
    <Title>PUBLIC BUSINESS. - DEFENCE FORCES (TEMPORARY PROVISIONS) (No. 2) BILL, 1927&mdash;FIFTH STAGE.</Title>
    <P>Motion made&mdash;That the Bill be received for final consideration and do now pass.</P>
    <P>Question put and agreed to.</P>
  </MainHeading>
  <MainHeading Type="GD" LHead="PUBLIC BUSINESS. - FINANCE (No." RHead="2) BILL, 1927&mdash;FIFTH STAGE">
    <Title>PUBLIC BUSINESS. - FINANCE (No. 2) BILL, 1927&mdash;FIFTH STAGE.</Title>
    <P>Motion made&mdash;That the Bill be received for final consideration and do now pass.</P>
    <P>Question put and agreed to.</P>
  </MainHeading>
  <MainHeading Type="GD" LHead="PUBLIC BUSINESS. -" RHead="THE ADJOURNMENT">
    <Title>PUBLIC BUSINESS. - THE ADJOURNMENT.</Title>
    <Speaker pid="" hpid="CATHAOIRLEACH CATHAOIRLEACH">
      <NameTxt>CATHAOIRLEACH</NameTxt>
      <P>As matters at present stand it will not be necessary for the Seanad to meet again before the 15th February next.  In the event of any contingency arising which would render a meeting of the House necessary, a meeting will be duly convened on proper notice.</P>
      <P>The Seanad adjourned at 12.10 p.m.</P>
    </Speaker>
  </MainHeading>
</Debate>